{
  "feature_id": "SYNTAX-CONSUME-NUMBER",
  "generation": 7,
  "review_id": "A",
  "scope": "PUBLIC_BOUNDARY_AND_AUTHOR_ADMISSION",
  "verdict": "REJECT",
  "identity": {
    "reviewer_id": "g7-boundary-spec-a",
    "role": "independent-specification-and-semantic-boundary-challenger",
    "served_model": "gpt-5.6-sol",
    "reasoning_effort": "inherited-not-exposed",
    "independent": true,
    "candidate_author": false,
    "root_adjudicator": false,
    "peer_review_access": false,
    "hidden_plaintext_or_key_access": false
  },
  "model_receipt": {
    "served_model": "gpt-5.6-sol",
    "input_manifest_sha256": "4a1b7096fb48a69240b66a2b9a4fb42a1707f71b5d0e0af0dcf50d8bf6c43422",
    "review_input_sha256": "39ea67fbd47ccd69426cf3146e130587b81b7b14213a282295d7cb0abf36393a",
    "commands": [
      "shasum -a 256 cells/syntax-consume-number/g7/manifest.json && wc -c cells/syntax-consume-number/g7/manifest.json",
      "node cells/syntax-consume-number/g7/author-admission-validator.mjs --self-check",
      "node cells/syntax-consume-number/g7/author-admission-validator.mjs --negative-controls",
      "node --check cells/syntax-consume-number/g7/author-admission-validator.mjs",
      "tsc --noEmit --strict --target ES2022 --module NodeNext --moduleResolution NodeNext --types node --resolveJsonModule --allowSyntheticDefaultImports --verbatimModuleSyntax cells/syntax-consume-number/g7/contract.ts cells/syntax-consume-number/g7/harness.ts",
      "printf <public H loop-and-mutation negative control> | node cells/syntax-consume-number/g7/author-admission-validator.mjs --assay-stdin h",
      "printf <public reachable whole-prefix wrapper negative control> | node cells/syntax-consume-number/g7/author-admission-validator.mjs --assay-stdin b",
      "printf <public reachable whole-prefix wrapper negative control> | node cells/syntax-consume-number/g7/author-admission-validator.mjs --assay-stdin s",
      "printf <public equivalent whole-prefix dispatch negative control> | node cells/syntax-consume-number/g7/author-admission-validator.mjs --assay-stdin d",
      "node cells/syntax-consume-number/g7/benchmark-validator.mjs --self-check",
      "node <public envelope, public-case-ID, review-input, binary64-edge, and hostile-length verification scripts>"
    ],
    "closed_at": "2026-07-22T12:38:46.000Z"
  },
  "subject": {
    "formation": {
      "sha256": "171516646086aea8d87d578b3a411c46c013b157173e7a62db1a26d6ac0d3cf0",
      "bytes": 6565
    },
    "precursor_closure_sha256": "8064807b6d594530c24c65c053a36c7a7ccd16e17a7d5f9b68966a264b76db73",
    "holdout_receipt": {
      "sha256": "6b861aa822815600147003ca354c1b38f9ed8a20d8540f6f77aead8d4cb1f1d2",
      "bytes": 2363
    },
    "holdout_ciphertext": {
      "sha256": "019e72116bdd5f3f216b7a42d8d9638ab666c6c5c8fc5ca880930ff8dd8d61b3",
      "bytes": 129225
    }
  },
  "three_altitude_findings": {
    "total_tranche": {
      "sequencing": {
        "verdict": "ACCEPT",
        "findings": [
          "The corrected ledger retires standalone SYNTAX-NUMBER-START, names SYNTAX-CONSUME-NUMBER as the active pilot, and permits pilot preparation without feature acceptance or broad fan-out. G7 begins from the terminal G6 rejection, freezes zero candidates, seals a fresh ciphertext before authors, and requires two challenges plus a distinct root before author invitation.",
          "This is formation sequencing only. The BORN-RED full denominator remains incomplete, and no candidate, parser, benchmark, integration, or production credit follows."
        ]
      },
      "denominator": {
        "verdict": "ACCEPT",
        "findings": [
          "The row is the smallest coherent consuming numeric operation: one maximal CSS Syntax §4.3.13 prefix, one semantic value/type/sign leaf, one value-unit owner, and percentage/dimension dispatch left above it.",
          "The six §4.3.10 true arms are correctly subordinate branch fixtures rather than a zero-width exported Parser<boolean>; source preprocessing/mapping, contextual bounds, units, tokens, CST, and serialization are explicitly outside this pilot row."
        ]
      },
      "boundary": {
        "verdict": "REJECT",
        "findings": [
          "The semantic operation is well chosen, but the author-isolation boundary, holdout proof/custody boundary, benchmark evidence join, and post-author five-plus-three owner-law gate are not closed by the frozen precursor.",
          "The public boundary therefore cannot safely advance to author invitation even though its formation and exact semantic leaf are useful design evidence."
        ]
      }
    },
    "feature_cell": {
      "correctness": {
        "verdict": "ACCEPT",
        "findings": [
          "The accepted-prefix expression matches the pinned §4.3.13 order: optional sign, digits or guarded dot-plus-digit fraction, then only a fully guarded exponent. Incomplete 1., 1e, and 1e+ tails remain unconsumed.",
          "Public-only edge classification remained coherent for +00.5E-00, -.0e-324, 1e309, -1e309, 9007199254740993, 1e+, 1.e1, +.e1, 0e999999, -0e999999, 5e-324, and 2.2250738585072012e-308."
        ]
      },
      "result": {
        "verdict": "ACCEPT",
        "findings": [
          "Number(exact consumed representation) supplies an explicit ECMAScript binary64 carrier. Object.is checks preserve negative zero and distinguish the declared underflow, signed-infinity, and rounding behavior.",
          "Reflect.ownKeys, Object.prototype, and exact writable/enumerable/configurable data-descriptor checks close the ordinary three-property value/type/sign result shape without raw, span, accessor, symbol, or surplus fields."
        ]
      },
      "diagnostics": {
        "verdict": "REJECT",
        "findings": [
          "feature-row.json claims every public failure is exercised against both modes, both profiles, and all seven predecessor classes, but harness.ts chooses predecessors[caseIndex % predecessors.length] once per case. Each failure sees one predecessor, yielding 40 failure executions instead of the claimed 280-cell predecessor cross-product.",
          "Enabled ordinary failure accepts any nonempty expected strings, and ordinary success does not constrain furthest, expected, suggestions, or secondarySpans. Candidate-specific observable diagnostic side effects can therefore diverge while all public checks pass."
        ]
      },
      "limits": {
        "verdict": "REJECT",
        "findings": [
          "The field named sizes_utf16_code_units is passed as a repeated-digit count. The declared 4096 schedule produces sources of 4097 code units for digits and 4099 for fraction, exponent, and incomplete-exponent; the same +1/+3 error persists at every doubling.",
          "Warmups are not timed, measured calls have no external watchdog, and a <=8 doubling ratio does not establish the declared O(n) law. The hostile H assay also proved that the topology validator admits an explicit loop and mutation despite the stated construction floor."
        ]
      },
      "hostility": {
        "verdict": "REJECT",
        "findings": [
          "runWorkLimitHarness checks only isError and final offset; it does not validate the hostile semantic leaf, binary64 value, type, sign, ordinary object shape, same-state return, or no-throw/global-diagnostic guarantees.",
          "The exact ciphertext framing is public-consistent, but the hidden coverage, cross-generation anti-duplication, candidate-access, freshness, and future revealability claims are assertions rather than publicly bound, recomputable custody evidence."
        ]
      },
      "composition": {
        "verdict": "REJECT",
        "findings": [
          "The composition harness verifies acceptance and only leaf.type plus the dimension unit. It does not verify composed value, sign, exact consumed prefix, final offset, ordinary leaf shape, or the rollback/diagnostic state of the integer rejection path.",
          "Consequently a context-specific wrong Number/sign mapping or non-transactional failure can pass all six public composition witnesses."
        ]
      }
    },
    "author_admission_and_tooling": {
      "review_integrity": {
        "verdict": "ACCEPT",
        "findings": [
          "The exact review/root schemas and validator require distinct reviewer identities, model/input receipts, full three-altitude axis sets, evidence, blockers, zero credit, exact subject hashes, and unanimous ACCEPT before pre-author admission.",
          "The official self-check reproduced 34 rows and closure 8064807b6d594530c24c65c053a36c7a7ccd16e17a7d5f9b68966a264b76db73 and rejected a content-free ACCEPT plus an ACCEPT carrying a blocker."
        ]
      },
      "holdout_integrity": {
        "verdict": "REJECT",
        "findings": [
          "The receipt/ciphertext hashes, canonical one-line base64, decoded length, VPI7CN1 NUL magic, plaintext-plus-36 framing, and sorted-LF hash of all 39 unique public case IDs were independently reproduced.",
          "Neither the schema nor validateHoldout binds a custodian identity/model/commands/close time, generator bytes, canonical hidden-case digest, prior-generation comparison inputs, or a durable reveal-custody route. The 184-case category and zero-duplication/freshness fields are accepted by value alone."
        ]
      },
      "provenance": {
        "verdict": "REJECT",
        "findings": [
          "The repaired H authority is truthfully authenticated to commit 9fce504a5764258c8e56b0ce77cd656c725a4907, blob cbb57ab5327bc0afa667fbd13ad98d77f3b610de, and historical line 96; H/B non-independence is also candidly disclosed.",